{
  "schema_version": "1",
  "contract_id": "CFTC_CME_BITCOIN_TFF_SOURCE_CONTRACT_V1",
  "authorization": "RESEARCH_ONLY_NOT_SHADOW_PAPER_OR_LIVE",
  "document_status": "OFFLINE_DISABLED_NOT_REGISTERED",
  "source_label": "CFTC_CME_BITCOIN_TFF_FUTURES_ONLY_V1",
  "source_identity": {
    "publisher": "U.S. COMMODITY FUTURES TRADING COMMISSION",
    "report_family": "TRADERS_IN_FINANCIAL_FUTURES",
    "report_variant": "FUTURES_ONLY",
    "market_and_exchange_name": "BITCOIN - CHICAGO MERCANTILE EXCHANGE",
    "cftc_contract_market_code": "133741",
    "locator": "https://www.cftc.gov/dea/newcot/FinFutWk.txt",
    "credentials": "NONE",
    "mode": "FORWARD_ONLY_OFFLINE_PACKAGE",
    "caller_overrides": "DENY",
    "fallback": "DENY"
  },
  "ordered_fields": [
    "Market_and_Exchange_Names",
    "As_of_Date_In_Form_YYMMDD",
    "Report_Date_as_MM_DD_YYYY",
    "CFTC_Contract_Market_Code",
    "CFTC_Market_Code",
    "CFTC_Region_Code",
    "CFTC_Commodity_Code",
    "Open_Interest_All",
    "Dealer_Positions_Long_All",
    "Dealer_Positions_Short_All",
    "Dealer_Positions_Spread_All",
    "Asset_Mgr_Positions_Long_All",
    "Asset_Mgr_Positions_Short_All",
    "Asset_Mgr_Positions_Spread_All",
    "Lev_Money_Positions_Long_All",
    "Lev_Money_Positions_Short_All",
    "Lev_Money_Positions_Spread_All",
    "Other_Rept_Positions_Long_All",
    "Other_Rept_Positions_Short_All",
    "Other_Rept_Positions_Spread_All",
    "Tot_Rept_Positions_Long_All",
    "Tot_Rept_Positions_Short_All",
    "NonRept_Positions_Long_All",
    "NonRept_Positions_Short_All",
    "Change_in_Open_Interest_All",
    "Change_in_Dealer_Long_All",
    "Change_in_Dealer_Short_All",
    "Change_in_Dealer_Spread_All",
    "Change_in_Asset_Mgr_Long_All",
    "Change_in_Asset_Mgr_Short_All",
    "Change_in_Asset_Mgr_Spread_All",
    "Change_in_Lev_Money_Long_All",
    "Change_in_Lev_Money_Short_All",
    "Change_in_Lev_Money_Spread_All",
    "Change_in_Other_Rept_Long_All",
    "Change_in_Other_Rept_Short_All",
    "Change_in_Other_Rept_Spread_All",
    "Change_in_Tot_Rept_Long_All",
    "Change_in_Tot_Rept_Short_All",
    "Change_in_NonRept_Long_All",
    "Change_in_NonRept_Short_All",
    "Pct_of_Open_Interest_All",
    "Pct_of_OI_Dealer_Long_All",
    "Pct_of_OI_Dealer_Short_All",
    "Pct_of_OI_Dealer_Spread_All",
    "Pct_of_OI_Asset_Mgr_Long_All",
    "Pct_of_OI_Asset_Mgr_Short_All",
    "Pct_of_OI_Asset_Mgr_Spread_All",
    "Pct_of_OI_Lev_Money_Long_All",
    "Pct_of_OI_Lev_Money_Short_All",
    "Pct_of_OI_Lev_Money_Spread_All",
    "Pct_of_OI_Other_Rept_Long_All",
    "Pct_of_OI_Other_Rept_Short_All",
    "Pct_of_OI_Other_Rept_Spread_All",
    "Pct_of_OI_Tot_Rept_Long_All",
    "Pct_of_OI_Tot_Rept_Short_All",
    "Pct_of_OI_NonRept_Long_All",
    "Pct_of_OI_NonRept_Short_All",
    "Traders_Tot_All",
    "Traders_Dealer_Long_All",
    "Traders_Dealer_Short_All",
    "Traders_Dealer_Spread_All",
    "Traders_Asset_Mgr_Long_All",
    "Traders_Asset_Mgr_Short_All",
    "Traders_Asset_Mgr_Spread_All",
    "Traders_Lev_Money_Long_All",
    "Traders_Lev_Money_Short_All",
    "Traders_Lev_Money_Spread_All",
    "Traders_Other_Rept_Long_All",
    "Traders_Other_Rept_Short_All",
    "Traders_Other_Rept_Spread_All",
    "Traders_Tot_Rept_Long_All",
    "Traders_Tot_Rept_Short_All",
    "Conc_Gross_LE_4_TDR_Long_All",
    "Conc_Gross_LE_4_TDR_Short_All",
    "Conc_Gross_LE_8_TDR_Long_All",
    "Conc_Gross_LE_8_TDR_Short_All",
    "Conc_Net_LE_4_TDR_Long_All",
    "Conc_Net_LE_4_TDR_Short_All",
    "Conc_Net_LE_8_TDR_Long_All",
    "Conc_Net_LE_8_TDR_Short_All",
    "Contract_Units",
    "CFTC_Contract_Market_Code_Quotes",
    "CFTC_Market_Code_Quotes",
    "CFTC_Commodity_Code_Quotes",
    "CFTC_SubGroup_Code",
    "FutOnly_or_Combined"
  ],
  "release_policy": {
    "release_schedule_proof": "CALLER_SUPPLIED_IMMUTABLE_VERSION_AND_SHA256",
    "observation_weekday": "TUESDAY",
    "release_timezone": "America/New_York",
    "release_local_time": "15:30:00",
    "release_lag_calendar_days": {
      "minimum": 3,
      "maximum": 6
    },
    "cloud_timer_authority": "CODEX_CLOUD_OPS_ONLY",
    "cloud_schedule_count": 1,
    "scheduled_cycle_timezone": "Asia/Taipei",
    "scheduled_cycle_local_time": "09:05:00",
    "scheduled_cycle_semantics": "FIRST_SOLE_CLOUD_CYCLE_STRICTLY_AFTER_RELEASE",
    "receipt_window": "AT_OR_AFTER_SCHEDULED_CYCLE_BEFORE_NEXT_CYCLE",
    "first_eligible_decision": "STRICTLY_AFTER_SEALED_RECEIPT"
  },
  "row_policy": {
    "header": "EXACT_ORDERED_87_FIELDS",
    "target_row": "EXACTLY_ONE_CONTRACT_CODE_133741",
    "raw_values": "PRESERVE_ALL_STRINGS",
    "suppression_markers": "PRESERVE_RAW",
    "secondary_identity": "NONEMPTY_THEN_EXACT_PREDECESSOR_BOUND",
    "derived_value_selection": "DENY"
  },
  "state_machine": {
    "states": [
      "NO_NEW_REPORT",
      "CONTRACT_ABSENT",
      "DUPLICATE_CONTRACT_ROW",
      "MALFORMED_REPORT",
      "WRONG_REPORT_FAMILY",
      "REPORT_DATE_IN_FUTURE",
      "RELEASE_NOT_DUE",
      "SOURCE_UNAVAILABLE",
      "SAME_REPORT_BYTES_DRIFT",
      "NEW_REPORT_SEALED"
    ],
    "same_date_changed_bytes": "INTEGRITY_BLOCK_NEVER_OVERWRITE",
    "alternate_source": "DENY",
    "overwrite": "DENY"
  },
  "sealing": {
    "raw_response": "BYTE_LENGTH_AND_SHA256_BEFORE_DECODE",
    "selected_record": "EXACT_BYTES_WITH_ORIGINAL_TERMINATOR_LENGTH_AND_SHA256",
    "canonical_row": "UTF8_COMPACT_SORTED_KEY_JSON_SHA256",
    "observation_document": "UTF8_COMPACT_SORTED_KEY_JSON",
    "chain_algorithm": "SHA-256",
    "predecessor": "EXACT_PRIOR_CHAIN_OR_64_ZERO_GENESIS"
  },
  "schemas": {
    "contract": {
      "path": "research_pipeline/cftc-cme-bitcoin-tff-source-contract.v1.schema.json",
      "id": "https://agora.local/research/cftc-cme-bitcoin-tff-source-contract.v1.schema.json",
      "sha256": "53d803202839c2b7d6882544289f2db4c03337159d0a2da8f3a0d913afb6ece3"
    },
    "observation": {
      "path": "research_pipeline/cftc-cme-bitcoin-tff-observation.v1.schema.json",
      "id": "https://agora.local/research/cftc-cme-bitcoin-tff-observation.v1.schema.json",
      "sha256": "91630c4a2c7275a766e7f9b3d3036ba69598098ed07c08fa8c4df5b629aa7e82"
    }
  },
  "architecture": {
    "future_producer": "NOT_IMPLEMENTED_FIXED_ZERO_PARAMETER",
    "transport": "NOT_IMPLEMENTED_CREATE_ONLY_ONE_WAY_HASH_BOUND",
    "canonical_intake": "NOT_IMPLEMENTED_NETWORK_DATABASE_DENIED",
    "state_authority": "SERVER_CANONICAL",
    "network_access": "DENY_IN_THIS_PACKAGE",
    "database_access": "DENY",
    "registration": "DENY",
    "capture": "DENY"
  },
  "readiness": {
    "source_registered": false,
    "producer_implemented": false,
    "transport_implemented": false,
    "intake_implemented": false,
    "capture_authorized": false,
    "factor_authorized": false,
    "hypothesis_authorized": false,
    "candidate_authorized": false,
    "oos_authorized": false,
    "trading_authorized": false,
    "immediate_performance_effect": "ZERO",
    "immediate_drawdown_effect": "ZERO"
  }
}
